{
  "schema": "abilities_v1",
  "skills": [
    {
      "id": "melee_combat",
      "name": "Blade Mastery",
      "category": "combat",
      "description": "Proficiency with close-quarters weapons. Each level increases damage and accuracy with melee attacks.",
      "max_level": 10,
      "base_cost": 5,
      "prerequisites": [],
      "passive_effects": [
        {
          "effect_type": "damage_bonus",
          "target": "melee",
          "value_per_level": 0.05,
          "max_value": 0.5
        },
        {
          "effect_type": "accuracy_bonus",
          "target": "melee",
          "value_per_level": 0.02,
          "max_value": 0.2
        }
      ]
    },
    {
      "id": "ranged_combat",
      "name": "Shard Casting",
      "category": "combat",
      "description": "Mastery of ranged weapons and glass projectiles. Each level increases damage and accuracy with ranged attacks.",
      "max_level": 10,
      "base_cost": 5,
      "prerequisites": [],
      "passive_effects": [
        {
          "effect_type": "damage_bonus",
          "target": "ranged",
          "value_per_level": 0.05,
          "max_value": 0.5
        },
        {
          "effect_type": "accuracy_bonus",
          "target": "ranged",
          "value_per_level": 0.02,
          "max_value": 0.2
        }
      ]
    },
    {
      "id": "defense",
      "name": "Salt Ward",
      "category": "combat",
      "description": "Defensive techniques and armor usage. Each level grants additional armor protection.",
      "max_level": 10,
      "base_cost": 6,
      "prerequisites": [],
      "passive_effects": [
        {
          "effect_type": "armor_bonus",
          "target": "defense",
          "value_per_level": 1.0,
          "max_value": 10.0
        }
      ]
    },
    {
      "id": "survival",
      "name": "Desert Conditioning",
      "category": "survival",
      "description": "Enduring the harsh Saltglass environment. Reduces resource consumption and environmental damage.",
      "max_level": 8,
      "base_cost": 4,
      "prerequisites": [],
      "passive_effects": [
        {
          "effect_type": "resource_efficiency",
          "target": "survival",
          "value_per_level": 0.05,
          "max_value": 0.4
        }
      ]
    },
    {
      "id": "stealth",
      "name": "Mirage Walking",
      "category": "athletics",
      "description": "Moving unseen through the desert. Reduces enemy detection range.",
      "max_level": 8,
      "base_cost": 5,
      "prerequisites": [],
      "passive_effects": [
        {
          "effect_type": "detection_reduction",
          "target": "stealth",
          "value_per_level": 0.1,
          "max_value": 0.8
        }
      ]
    },
    {
      "id": "wayfaring",
      "name": "Wayfaring",
      "category": "survival",
      "description": "Expert navigation and travel through the Steppe. Reduces encounter rate and improves flee chance.",
      "max_level": 10,
      "base_cost": 6,
      "prerequisites": [
        {
          "skill_id": "survival",
          "required_level": 2
        }
      ],
      "passive_effects": [
        {
          "effect_type": "encounter_reduction",
          "target": "travel",
          "value_per_level": 0.05,
          "max_value": 0.5
        },
        {
          "effect_type": "flee_bonus",
          "target": "combat",
          "value_per_level": 0.1,
          "max_value": 1.0
        }
      ]
    },
    {
      "id": "navigation",
      "name": "Steppe Lore",
      "category": "survival",
      "description": "Knowledge of the Saltglass terrain and landmarks. Reveals points of interest on the world map.",
      "max_level": 6,
      "base_cost": 5,
      "prerequisites": [
        {
          "skill_id": "survival",
          "required_level": 1
        }
      ],
      "passive_effects": [
        {
          "effect_type": "map_reveal",
          "target": "navigation",
          "value_per_level": 1.0,
          "max_value": 6.0
        }
      ]
    },
    {
      "id": "medicine",
      "name": "Flesh Mending",
      "category": "survival",
      "description": "Healing wounds and treating ailments. Increases effectiveness of healing items and rest.",
      "max_level": 8,
      "base_cost": 6,
      "prerequisites": [
        {
          "skill_id": "survival",
          "required_level": 1
        }
      ],
      "passive_effects": [
        {
          "effect_type": "healing_bonus",
          "target": "medicine",
          "value_per_level": 0.1,
          "max_value": 0.8
        }
      ]
    },
    {
      "id": "bartering",
      "name": "Salt Trading",
      "category": "social",
      "description": "Commerce and negotiation skills. Improves buy and sell prices at shops.",
      "max_level": 8,
      "base_cost": 5,
      "prerequisites": [],
      "passive_effects": [
        {
          "effect_type": "buy_price_reduction",
          "target": "trading",
          "value_per_level": 0.05,
          "max_value": 0.4
        },
        {
          "effect_type": "sell_price_bonus",
          "target": "trading",
          "value_per_level": 0.05,
          "max_value": 0.4
        }
      ]
    },
    {
      "id": "crafting",
      "name": "Glass Shaping",
      "category": "crafting",
      "description": "Creating and modifying equipment. Improves crafting success rate and item quality.",
      "max_level": 8,
      "base_cost": 5,
      "prerequisites": [],
      "passive_effects": [
        {
          "effect_type": "craft_success",
          "target": "crafting",
          "value_per_level": 0.05,
          "max_value": 0.4
        },
        {
          "effect_type": "craft_quality",
          "target": "crafting",
          "value_per_level": 0.05,
          "max_value": 0.4
        }
      ]
    }
  ],
  "abilities": [
    {
      "id": "blade_strike",
      "name": "Blade Strike",
      "category": "Combat",
      "description": "Swift melee attack with increased accuracy",
      "stamina_cost": 12,
      "cooldown": 3,
      "required_skill": "Combat",
      "required_level": 1,
      "effect_type": "Combat",
      "target_type": "Single",
      "effect_data": {
        "primary_effect": "damage",
        "magnitude": 8,
        "duration": 0
      }
    },
    {
      "id": "defensive_stance",
      "name": "Defensive Stance",
      "category": "Combat",
      "description": "Reduce incoming damage for several turns",
      "stamina_cost": 15,
      "cooldown": 5,
      "required_skill": "Combat",
      "required_level": 3,
      "effect_type": "Combat",
      "target_type": "Self",
      "effect_data": {
        "primary_effect": "damage_reduction",
        "magnitude": 3,
        "duration": 5
      }
    },
    {
      "id": "whirlwind_strike",
      "name": "Whirlwind Strike",
      "category": "Combat",
      "description": "Attack all adjacent enemies with glass-edged fury",
      "stamina_cost": 25,
      "cooldown": 7,
      "required_skill": "Combat",
      "required_level": 5,
      "effect_type": "Combat",
      "target_type": "Adjacent",
      "effect_data": {
        "primary_effect": "damage",
        "magnitude": 6,
        "duration": 0
      }
    },
    {
      "id": "berserker_rage",
      "name": "Berserker Rage",
      "category": "Combat",
      "description": "Channel storm fury for devastating attacks",
      "stamina_cost": 30,
      "cooldown": 10,
      "required_skill": "Combat",
      "required_level": 7,
      "effect_type": "Combat",
      "target_type": "Self",
      "effect_data": {
        "primary_effect": "damage_boost",
        "magnitude": 5,
        "duration": 4
      }
    },
    {
      "id": "glass_shard_barrage",
      "name": "Glass Shard Barrage",
      "category": "Combat",
      "description": "Hurl crystallized storm energy in a deadly line",
      "stamina_cost": 28,
      "cooldown": 8,
      "required_skill": "Combat",
      "required_level": 10,
      "effect_type": "Combat",
      "target_type": "Line",
      "effect_data": {
        "primary_effect": "damage",
        "magnitude": 12,
        "duration": 0
      }
    },
    {
      "id": "quick_step",
      "name": "Quick Step",
      "category": "Movement",
      "description": "Swift movement across salt-crusted ground",
      "stamina_cost": 8,
      "cooldown": 3,
      "required_skill": "Movement",
      "required_level": 1,
      "effect_type": "Movement",
      "target_type": "Self",
      "effect_data": {
        "primary_effect": "extra_move",
        "magnitude": 1,
        "duration": 1
      }
    },
    {
      "id": "shimmer_dash",
      "name": "Shimmer Dash",
      "category": "Movement",
      "description": "Phase through glass terrain like a mirage",
      "stamina_cost": 12,
      "cooldown": 5,
      "required_skill": "Movement",
      "required_level": 3,
      "effect_type": "Movement",
      "target_type": "Self",
      "effect_data": {
        "primary_effect": "phase_movement",
        "magnitude": 3,
        "duration": 1
      }
    },
    {
      "id": "salt_wind_leap",
      "name": "Salt Wind Leap",
      "category": "Movement",
      "description": "Leap over obstacles on crystalline winds",
      "stamina_cost": 15,
      "cooldown": 6,
      "required_skill": "Movement",
      "required_level": 5,
      "effect_type": "Movement",
      "target_type": "Self",
      "effect_data": {
        "primary_effect": "leap",
        "magnitude": 4,
        "duration": 0
      }
    },
    {
      "id": "storm_stride",
      "name": "Storm Stride",
      "category": "Movement",
      "description": "Move with the fury of glass storms",
      "stamina_cost": 18,
      "cooldown": 7,
      "required_skill": "Movement",
      "required_level": 7,
      "effect_type": "Movement",
      "target_type": "Self",
      "effect_data": {
        "primary_effect": "speed_boost",
        "magnitude": 2,
        "duration": 3
      }
    },
    {